<?xml version="1.0" encoding="UTF-8"?>
<zathura-generator  xmlns:xsi='http://www.w3.org/2001/XMLSchema-instance'
   xmlns='http://lidis.usbcali.edu.co/schema/zathura-generator-factory-config'
   xsi:schemaLocation='http://lidis.usbcali.edu.co/schema/zathura-generator-factory-config zathura-generator-factory-config.xsd'>
   
	<generator>
		<name>ZathuraJavaEE_Web_Centric</name>
		<gui-name>IceFaces + JPA</gui-name>
		<class>co.edu.usbcali.lidis.zathura.generator.jee.jpa.webcentric.engine.ZathuraJavaEE_JPA_Web_Centric</class>
		<persistence>jpa</persistence>
		<logic>pojo</logic>
		<view>icefaces</view>
		<description>Icefaces,pojo,jpa</description>
	</generator>
	
	<generator>
		<name>ZathuraJavaEE_HibernateCore_Web_Centric</name>
		<gui-name>IceFaces + HibernateCore</gui-name>
		<class>com.vortexbird.amazilia.generator.jee.hibernatecore.webcentric.engine.ZathuraJavaEE_HibernateCore_Web_Centric</class>
		<persistence>hibernateCore</persistence>
		<logic>pojo</logic>
		<view>icefaces</view>
		<description></description>
	</generator>
	
	
	<generator>
		<name>ZathuraJavaEE_HibernateCore_Spring_Web_Centric</name>
		<gui-name>IceFaces + Hibernate Core + Spring</gui-name>
		<class>com.vortexbird.amazilia.generator.jee.hibernatecore.springcentric.engine.ZathuraJavaEE_HibernateCore_Web_Spring_Centric</class>
		<persistence>hibernateCore</persistence>
		<logic>spring</logic>
		<view>icefaces</view>
		<description></description>
	</generator>
	
	<generator>
		<name>ZathuraJavaEE_GWT_Centric</name>
		<gui-name>GWT + JPA</gui-name>
		<class>co.edu.usbcali.lidis.zathura.generator.jee.jpa.gwtcentric.engine.ZathuraJavaEE_Gwt_Centric</class>
		<persistence>jpa</persistence>
		<logic>pojo</logic>
		<view>gwt</view>
		<description></description>
	</generator>
	
</zathura-generator>
